[ Sat Dec 20 20:29:46 2025 ] using warm up, epoch: 5
[ Sat Dec 20 20:29:53 2025 ] Parameters:
{'work_dir': '/content/drive/MyDrive/Colab Notebooks/thesis_outline_colabs/CTR-GCN/runs/test_run_ntu60_2d_2', 'model_saved_name': '/content/drive/MyDrive/Colab Notebooks/thesis_outline_colabs/CTR-GCN/runs/test_run_ntu60_2d_2/runs', 'config': 'config/ntu2d/default.yaml', 'phase': 'train', 'save_score': False, 'seed': 1, 'log_interval': 100, 'save_interval': 1, 'save_epoch': 1, 'eval_interval': 5, 'print_log': True, 'show_topk': [1, 5], 'feeder': 'feeders.feeder_ntu_2d.Feeder', 'num_worker': 1, 'train_feeder_args': {'data_path': '/content/drive/MyDrive/Colab Notebooks/thesis_outline_colabs/data/ntu60_2d.pkl', 'split': 'train', 'split_type': 'xsub', 'debug': False, 'random_choose': False, 'random_shift': False, 'random_move': False, 'window_size': 64, 'normalization': False, 'random_rot': False, 'p_interval': [0.5, 1], 'vel': False, 'bone': False}, 'test_feeder_args': {'data_path': '/content/drive/MyDrive/Colab Notebooks/thesis_outline_colabs/data/ntu60_2d.pkl', 'split': 'test', 'split_type': 'xsub', 'window_size': 64, 'p_interval': [0.95], 'vel': False, 'bone': False, 'debug': False}, 'model': 'model.ctrgcn.Model', 'model_args': {'num_class': 60, 'num_point': 17, 'num_person': 1, 'in_channels': 2, 'graph': 'graph.joint17.Graph', 'graph_args': {'labeling_mode': 'spatial'}}, 'weights': None, 'ignore_weights': [], 'base_lr': 0.1, 'step': [35, 55], 'device': [0], 'optimizer': 'SGD', 'nesterov': True, 'batch_size': 256, 'test_batch_size': 64, 'start_epoch': 0, 'num_epoch': 65, 'weight_decay': 0.0004, 'lr_decay_rate': 0.1, 'warm_up_epoch': 5}

[ Sat Dec 20 20:29:53 2025 ] # Parameters: 1434586
[ Sat Dec 20 20:29:53 2025 ] Training epoch: 1
[ Sat Dec 20 20:33:38 2025 ] 	Mean training loss: 3.5194.  Mean training acc: 13.36%.
[ Sat Dec 20 20:33:38 2025 ] 	Time consumption: [Data]00%, [Network]100%
[ Sat Dec 20 20:33:38 2025 ] Eval epoch: 1
[ Sat Dec 20 20:34:06 2025 ] 	Mean test loss of 258 batches: 2.9479601872983827.
[ Sat Dec 20 20:34:06 2025 ] 	Top1: 21.57%
[ Sat Dec 20 20:34:06 2025 ] 	Top5: 48.94%
[ Sat Dec 20 20:34:06 2025 ] Training epoch: 2
[ Sat Dec 20 20:37:52 2025 ] 	Mean training loss: 2.3897.  Mean training acc: 32.81%.
[ Sat Dec 20 20:37:52 2025 ] 	Time consumption: [Data]00%, [Network]100%
[ Sat Dec 20 20:37:53 2025 ] Eval epoch: 2
[ Sat Dec 20 20:38:20 2025 ] 	Mean test loss of 258 batches: 1.9496726878853732.
[ Sat Dec 20 20:38:21 2025 ] 	Top1: 44.39%
[ Sat Dec 20 20:38:21 2025 ] 	Top5: 79.69%
[ Sat Dec 20 20:38:21 2025 ] Training epoch: 3
[ Sat Dec 20 20:42:07 2025 ] 	Mean training loss: 1.5758.  Mean training acc: 51.99%.
[ Sat Dec 20 20:42:07 2025 ] 	Time consumption: [Data]00%, [Network]100%
[ Sat Dec 20 20:42:07 2025 ] Eval epoch: 3
[ Sat Dec 20 20:42:35 2025 ] 	Mean test loss of 258 batches: 1.5413113640722378.
[ Sat Dec 20 20:42:35 2025 ] 	Top1: 53.14%
[ Sat Dec 20 20:42:35 2025 ] 	Top5: 88.07%
[ Sat Dec 20 20:42:35 2025 ] Training epoch: 4
[ Sat Dec 20 20:46:22 2025 ] 	Mean training loss: 1.1536.  Mean training acc: 63.43%.
[ Sat Dec 20 20:46:22 2025 ] 	Time consumption: [Data]00%, [Network]100%
[ Sat Dec 20 20:46:22 2025 ] Eval epoch: 4
[ Sat Dec 20 20:46:50 2025 ] 	Mean test loss of 258 batches: 1.3010588496230369.
[ Sat Dec 20 20:46:50 2025 ] 	Top1: 60.17%
[ Sat Dec 20 20:46:50 2025 ] 	Top5: 90.81%
[ Sat Dec 20 20:46:50 2025 ] Training epoch: 5
[ Sat Dec 20 20:50:37 2025 ] 	Mean training loss: 0.9445.  Mean training acc: 69.71%.
[ Sat Dec 20 20:50:37 2025 ] 	Time consumption: [Data]00%, [Network]99%
[ Sat Dec 20 20:50:37 2025 ] Eval epoch: 5
[ Sat Dec 20 20:51:05 2025 ] 	Mean test loss of 258 batches: 1.18759469861208.
[ Sat Dec 20 20:51:05 2025 ] 	Top1: 63.01%
[ Sat Dec 20 20:51:05 2025 ] 	Top5: 92.11%
[ Sat Dec 20 20:51:05 2025 ] Training epoch: 6
[ Sat Dec 20 20:54:51 2025 ] 	Mean training loss: 0.7936.  Mean training acc: 74.15%.
[ Sat Dec 20 20:54:51 2025 ] 	Time consumption: [Data]00%, [Network]100%
[ Sat Dec 20 20:54:51 2025 ] Eval epoch: 6
[ Sat Dec 20 20:55:19 2025 ] 	Mean test loss of 258 batches: 1.0714871959630834.
[ Sat Dec 20 20:55:20 2025 ] 	Top1: 66.48%
[ Sat Dec 20 20:55:20 2025 ] 	Top5: 94.33%
[ Sat Dec 20 20:55:20 2025 ] Training epoch: 7
[ Sat Dec 20 20:59:06 2025 ] 	Mean training loss: 0.7068.  Mean training acc: 76.53%.
[ Sat Dec 20 20:59:06 2025 ] 	Time consumption: [Data]00%, [Network]100%
[ Sat Dec 20 20:59:06 2025 ] Eval epoch: 7
[ Sat Dec 20 20:59:34 2025 ] 	Mean test loss of 258 batches: 1.0167101397532825.
[ Sat Dec 20 20:59:34 2025 ] 	Top1: 67.23%
[ Sat Dec 20 20:59:34 2025 ] 	Top5: 94.66%
[ Sat Dec 20 20:59:34 2025 ] Training epoch: 8
[ Sat Dec 20 21:03:20 2025 ] 	Mean training loss: 0.6254.  Mean training acc: 79.26%.
[ Sat Dec 20 21:03:21 2025 ] 	Time consumption: [Data]00%, [Network]100%
[ Sat Dec 20 21:03:21 2025 ] Eval epoch: 8
[ Sat Dec 20 21:03:49 2025 ] 	Mean test loss of 258 batches: 1.133650614771732.
[ Sat Dec 20 21:03:49 2025 ] 	Top1: 64.90%
[ Sat Dec 20 21:03:49 2025 ] 	Top5: 93.18%
[ Sat Dec 20 21:03:49 2025 ] Training epoch: 9
[ Sat Dec 20 21:07:35 2025 ] 	Mean training loss: 0.5756.  Mean training acc: 80.57%.
[ Sat Dec 20 21:07:35 2025 ] 	Time consumption: [Data]00%, [Network]99%
[ Sat Dec 20 21:07:35 2025 ] Eval epoch: 9
[ Sat Dec 20 21:08:03 2025 ] 	Mean test loss of 258 batches: 0.8310123670470807.
[ Sat Dec 20 21:08:03 2025 ] 	Top1: 73.43%
[ Sat Dec 20 21:08:04 2025 ] 	Top5: 96.23%
[ Sat Dec 20 21:08:04 2025 ] Training epoch: 10
[ Sat Dec 20 21:11:50 2025 ] 	Mean training loss: 0.5265.  Mean training acc: 82.04%.
[ Sat Dec 20 21:11:50 2025 ] 	Time consumption: [Data]00%, [Network]99%
[ Sat Dec 20 21:11:50 2025 ] Eval epoch: 10
[ Sat Dec 20 21:12:18 2025 ] 	Mean test loss of 258 batches: 0.7624947632005973.
[ Sat Dec 20 21:12:18 2025 ] 	Top1: 75.17%
[ Sat Dec 20 21:12:18 2025 ] 	Top5: 96.84%
[ Sat Dec 20 21:12:18 2025 ] Training epoch: 11
[ Sat Dec 20 21:16:04 2025 ] 	Mean training loss: 0.4949.  Mean training acc: 83.38%.
[ Sat Dec 20 21:16:04 2025 ] 	Time consumption: [Data]00%, [Network]100%
[ Sat Dec 20 21:16:04 2025 ] Eval epoch: 11
[ Sat Dec 20 21:16:32 2025 ] 	Mean test loss of 258 batches: 0.8423537767903749.
[ Sat Dec 20 21:16:32 2025 ] 	Top1: 73.75%
[ Sat Dec 20 21:16:32 2025 ] 	Top5: 95.94%
[ Sat Dec 20 21:16:32 2025 ] Training epoch: 12
[ Sat Dec 20 21:20:18 2025 ] 	Mean training loss: 0.4585.  Mean training acc: 84.39%.
[ Sat Dec 20 21:20:18 2025 ] 	Time consumption: [Data]00%, [Network]100%
[ Sat Dec 20 21:20:18 2025 ] Eval epoch: 12
[ Sat Dec 20 21:20:46 2025 ] 	Mean test loss of 258 batches: 0.8737593491872152.
[ Sat Dec 20 21:20:46 2025 ] 	Top1: 73.02%
[ Sat Dec 20 21:20:46 2025 ] 	Top5: 96.08%
[ Sat Dec 20 21:20:46 2025 ] Training epoch: 13
[ Sat Dec 20 21:24:32 2025 ] 	Mean training loss: 0.4280.  Mean training acc: 85.64%.
[ Sat Dec 20 21:24:32 2025 ] 	Time consumption: [Data]00%, [Network]100%
[ Sat Dec 20 21:24:32 2025 ] Eval epoch: 13
[ Sat Dec 20 21:25:00 2025 ] 	Mean test loss of 258 batches: 0.8006458037583403.
[ Sat Dec 20 21:25:00 2025 ] 	Top1: 74.59%
[ Sat Dec 20 21:25:00 2025 ] 	Top5: 96.68%
[ Sat Dec 20 21:25:00 2025 ] Training epoch: 14
[ Sat Dec 20 21:28:46 2025 ] 	Mean training loss: 0.4144.  Mean training acc: 85.69%.
[ Sat Dec 20 21:28:46 2025 ] 	Time consumption: [Data]00%, [Network]100%
[ Sat Dec 20 21:28:46 2025 ] Eval epoch: 14
[ Sat Dec 20 21:29:14 2025 ] 	Mean test loss of 258 batches: 0.9797202575114347.
[ Sat Dec 20 21:29:14 2025 ] 	Top1: 72.97%
[ Sat Dec 20 21:29:14 2025 ] 	Top5: 95.78%
[ Sat Dec 20 21:29:14 2025 ] Training epoch: 15
[ Sat Dec 20 21:33:00 2025 ] 	Mean training loss: 0.3946.  Mean training acc: 86.53%.
[ Sat Dec 20 21:33:00 2025 ] 	Time consumption: [Data]00%, [Network]100%
[ Sat Dec 20 21:33:00 2025 ] Eval epoch: 15
[ Sat Dec 20 21:33:28 2025 ] 	Mean test loss of 258 batches: 0.8274837698816329.
[ Sat Dec 20 21:33:29 2025 ] 	Top1: 74.69%
[ Sat Dec 20 21:33:29 2025 ] 	Top5: 96.80%
[ Sat Dec 20 21:33:29 2025 ] Training epoch: 16
[ Sat Dec 20 21:37:15 2025 ] 	Mean training loss: 0.3740.  Mean training acc: 87.20%.
[ Sat Dec 20 21:37:15 2025 ] 	Time consumption: [Data]00%, [Network]99%
[ Sat Dec 20 21:37:15 2025 ] Eval epoch: 16
[ Sat Dec 20 21:37:43 2025 ] 	Mean test loss of 258 batches: 0.7089875551850296.
[ Sat Dec 20 21:37:43 2025 ] 	Top1: 78.05%
[ Sat Dec 20 21:37:43 2025 ] 	Top5: 97.04%
[ Sat Dec 20 21:37:43 2025 ] Training epoch: 17
[ Sat Dec 20 21:41:29 2025 ] 	Mean training loss: 0.3623.  Mean training acc: 87.54%.
[ Sat Dec 20 21:41:29 2025 ] 	Time consumption: [Data]00%, [Network]100%
[ Sat Dec 20 21:41:29 2025 ] Eval epoch: 17
[ Sat Dec 20 21:41:57 2025 ] 	Mean test loss of 258 batches: 0.7483719096396321.
[ Sat Dec 20 21:41:57 2025 ] 	Top1: 76.52%
[ Sat Dec 20 21:41:57 2025 ] 	Top5: 97.04%
[ Sat Dec 20 21:41:57 2025 ] Training epoch: 18
[ Sat Dec 20 21:45:43 2025 ] 	Mean training loss: 0.3426.  Mean training acc: 88.25%.
[ Sat Dec 20 21:45:43 2025 ] 	Time consumption: [Data]00%, [Network]99%
[ Sat Dec 20 21:45:43 2025 ] Eval epoch: 18
[ Sat Dec 20 21:46:11 2025 ] 	Mean test loss of 258 batches: 0.7238813621360202.
[ Sat Dec 20 21:46:11 2025 ] 	Top1: 77.96%
[ Sat Dec 20 21:46:11 2025 ] 	Top5: 97.18%
[ Sat Dec 20 21:46:11 2025 ] Training epoch: 19
[ Sat Dec 20 21:49:57 2025 ] 	Mean training loss: 0.3335.  Mean training acc: 88.65%.
[ Sat Dec 20 21:49:57 2025 ] 	Time consumption: [Data]00%, [Network]100%
[ Sat Dec 20 21:49:57 2025 ] Eval epoch: 19
[ Sat Dec 20 21:50:25 2025 ] 	Mean test loss of 258 batches: 0.9056784686192062.
[ Sat Dec 20 21:50:25 2025 ] 	Top1: 73.46%
[ Sat Dec 20 21:50:25 2025 ] 	Top5: 95.06%
[ Sat Dec 20 21:50:25 2025 ] Training epoch: 20
[ Sat Dec 20 21:54:11 2025 ] 	Mean training loss: 0.3273.  Mean training acc: 88.77%.
[ Sat Dec 20 21:54:11 2025 ] 	Time consumption: [Data]00%, [Network]100%
[ Sat Dec 20 21:54:11 2025 ] Eval epoch: 20
[ Sat Dec 20 21:54:39 2025 ] 	Mean test loss of 258 batches: 0.6787692336148994.
[ Sat Dec 20 21:54:39 2025 ] 	Top1: 79.47%
[ Sat Dec 20 21:54:39 2025 ] 	Top5: 97.48%
[ Sat Dec 20 21:54:39 2025 ] Training epoch: 21
[ Sat Dec 20 21:58:25 2025 ] 	Mean training loss: 0.3194.  Mean training acc: 88.99%.
[ Sat Dec 20 21:58:25 2025 ] 	Time consumption: [Data]00%, [Network]100%
[ Sat Dec 20 21:58:25 2025 ] Eval epoch: 21
[ Sat Dec 20 21:58:53 2025 ] 	Mean test loss of 258 batches: 0.7113228611243788.
[ Sat Dec 20 21:58:53 2025 ] 	Top1: 77.76%
[ Sat Dec 20 21:58:53 2025 ] 	Top5: 97.13%
[ Sat Dec 20 21:58:53 2025 ] Training epoch: 22
[ Sat Dec 20 22:02:39 2025 ] 	Mean training loss: 0.3028.  Mean training acc: 89.59%.
[ Sat Dec 20 22:02:39 2025 ] 	Time consumption: [Data]00%, [Network]100%
[ Sat Dec 20 22:02:39 2025 ] Eval epoch: 22
[ Sat Dec 20 22:03:07 2025 ] 	Mean test loss of 258 batches: 0.7969009312548379.
[ Sat Dec 20 22:03:07 2025 ] 	Top1: 75.95%
[ Sat Dec 20 22:03:07 2025 ] 	Top5: 96.37%
[ Sat Dec 20 22:03:07 2025 ] Training epoch: 23
[ Sat Dec 20 22:06:53 2025 ] 	Mean training loss: 0.2931.  Mean training acc: 89.97%.
[ Sat Dec 20 22:06:53 2025 ] 	Time consumption: [Data]00%, [Network]99%
[ Sat Dec 20 22:06:53 2025 ] Eval epoch: 23
[ Sat Dec 20 22:07:22 2025 ] 	Mean test loss of 258 batches: 0.6999705257110818.
[ Sat Dec 20 22:07:22 2025 ] 	Top1: 79.23%
[ Sat Dec 20 22:07:22 2025 ] 	Top5: 97.19%
[ Sat Dec 20 22:07:22 2025 ] Training epoch: 24
[ Sat Dec 20 22:11:07 2025 ] 	Mean training loss: 0.2922.  Mean training acc: 89.85%.
[ Sat Dec 20 22:11:07 2025 ] 	Time consumption: [Data]00%, [Network]100%
[ Sat Dec 20 22:11:08 2025 ] Eval epoch: 24
[ Sat Dec 20 22:11:35 2025 ] 	Mean test loss of 258 batches: 0.7489360741866652.
[ Sat Dec 20 22:11:36 2025 ] 	Top1: 77.32%
[ Sat Dec 20 22:11:36 2025 ] 	Top5: 97.16%
[ Sat Dec 20 22:11:36 2025 ] Training epoch: 25
[ Sat Dec 20 22:15:22 2025 ] 	Mean training loss: 0.2852.  Mean training acc: 90.30%.
[ Sat Dec 20 22:15:22 2025 ] 	Time consumption: [Data]00%, [Network]100%
[ Sat Dec 20 22:15:22 2025 ] Eval epoch: 25
[ Sat Dec 20 22:15:50 2025 ] 	Mean test loss of 258 batches: 0.74183205665313.
[ Sat Dec 20 22:15:50 2025 ] 	Top1: 78.14%
[ Sat Dec 20 22:15:50 2025 ] 	Top5: 97.08%
[ Sat Dec 20 22:15:50 2025 ] Training epoch: 26
[ Sat Dec 20 22:19:35 2025 ] 	Mean training loss: 0.2790.  Mean training acc: 90.41%.
[ Sat Dec 20 22:19:35 2025 ] 	Time consumption: [Data]00%, [Network]100%
[ Sat Dec 20 22:19:35 2025 ] Eval epoch: 26
[ Sat Dec 20 22:20:03 2025 ] 	Mean test loss of 258 batches: 0.670978688569956.
[ Sat Dec 20 22:20:03 2025 ] 	Top1: 79.80%
[ Sat Dec 20 22:20:04 2025 ] 	Top5: 97.11%
[ Sat Dec 20 22:20:04 2025 ] Training epoch: 27
[ Sat Dec 20 22:23:48 2025 ] 	Mean training loss: 0.2728.  Mean training acc: 90.73%.
[ Sat Dec 20 22:23:48 2025 ] 	Time consumption: [Data]00%, [Network]100%
[ Sat Dec 20 22:23:49 2025 ] Eval epoch: 27
[ Sat Dec 20 22:24:17 2025 ] 	Mean test loss of 258 batches: 0.7023697664109312.
[ Sat Dec 20 22:24:17 2025 ] 	Top1: 78.78%
[ Sat Dec 20 22:24:17 2025 ] 	Top5: 97.53%
[ Sat Dec 20 22:24:17 2025 ] Training epoch: 28
[ Sat Dec 20 22:28:02 2025 ] 	Mean training loss: 0.2644.  Mean training acc: 91.12%.
[ Sat Dec 20 22:28:02 2025 ] 	Time consumption: [Data]00%, [Network]100%
[ Sat Dec 20 22:28:02 2025 ] Eval epoch: 28
[ Sat Dec 20 22:28:30 2025 ] 	Mean test loss of 258 batches: 0.792324025039525.
[ Sat Dec 20 22:28:30 2025 ] 	Top1: 76.11%
[ Sat Dec 20 22:28:31 2025 ] 	Top5: 96.67%
[ Sat Dec 20 22:28:31 2025 ] Training epoch: 29
[ Sat Dec 20 22:32:16 2025 ] 	Mean training loss: 0.2610.  Mean training acc: 90.89%.
[ Sat Dec 20 22:32:16 2025 ] 	Time consumption: [Data]00%, [Network]100%
[ Sat Dec 20 22:32:17 2025 ] Eval epoch: 29
[ Sat Dec 20 22:32:45 2025 ] 	Mean test loss of 258 batches: 0.7824683954087339.
[ Sat Dec 20 22:32:45 2025 ] 	Top1: 77.93%
[ Sat Dec 20 22:32:45 2025 ] 	Top5: 96.81%
[ Sat Dec 20 22:32:45 2025 ] Training epoch: 30
[ Sat Dec 20 22:36:31 2025 ] 	Mean training loss: 0.2556.  Mean training acc: 91.22%.
[ Sat Dec 20 22:36:31 2025 ] 	Time consumption: [Data]00%, [Network]99%
[ Sat Dec 20 22:36:31 2025 ] Eval epoch: 30
[ Sat Dec 20 22:36:59 2025 ] 	Mean test loss of 258 batches: 0.8389180794704792.
[ Sat Dec 20 22:36:59 2025 ] 	Top1: 75.86%
[ Sat Dec 20 22:36:59 2025 ] 	Top5: 96.13%
[ Sat Dec 20 22:36:59 2025 ] Training epoch: 31
[ Sat Dec 20 22:40:45 2025 ] 	Mean training loss: 0.2483.  Mean training acc: 91.63%.
[ Sat Dec 20 22:40:45 2025 ] 	Time consumption: [Data]00%, [Network]100%
[ Sat Dec 20 22:40:45 2025 ] Eval epoch: 31
[ Sat Dec 20 22:41:13 2025 ] 	Mean test loss of 258 batches: 0.8842745908471041.
[ Sat Dec 20 22:41:13 2025 ] 	Top1: 74.51%
[ Sat Dec 20 22:41:13 2025 ] 	Top5: 96.06%
[ Sat Dec 20 22:41:13 2025 ] Training epoch: 32
[ Sat Dec 20 22:44:59 2025 ] 	Mean training loss: 0.2513.  Mean training acc: 91.40%.
[ Sat Dec 20 22:44:59 2025 ] 	Time consumption: [Data]00%, [Network]100%
[ Sat Dec 20 22:44:59 2025 ] Eval epoch: 32
[ Sat Dec 20 22:45:27 2025 ] 	Mean test loss of 258 batches: 0.7894759304070658.
[ Sat Dec 20 22:45:27 2025 ] 	Top1: 76.85%
[ Sat Dec 20 22:45:27 2025 ] 	Top5: 96.79%
[ Sat Dec 20 22:45:27 2025 ] Training epoch: 33
[ Sat Dec 20 22:49:12 2025 ] 	Mean training loss: 0.2508.  Mean training acc: 91.52%.
[ Sat Dec 20 22:49:12 2025 ] 	Time consumption: [Data]00%, [Network]100%
[ Sat Dec 20 22:49:12 2025 ] Eval epoch: 33
[ Sat Dec 20 22:49:40 2025 ] 	Mean test loss of 258 batches: 0.6719326746556186.
[ Sat Dec 20 22:49:40 2025 ] 	Top1: 80.17%
[ Sat Dec 20 22:49:41 2025 ] 	Top5: 97.50%
[ Sat Dec 20 22:49:41 2025 ] Training epoch: 34
[ Sat Dec 20 22:53:26 2025 ] 	Mean training loss: 0.2292.  Mean training acc: 92.17%.
[ Sat Dec 20 22:53:26 2025 ] 	Time consumption: [Data]00%, [Network]99%
[ Sat Dec 20 22:53:26 2025 ] Eval epoch: 34
[ Sat Dec 20 22:53:54 2025 ] 	Mean test loss of 258 batches: 0.7859027846608051.
[ Sat Dec 20 22:53:55 2025 ] 	Top1: 77.56%
[ Sat Dec 20 22:53:55 2025 ] 	Top5: 97.31%
[ Sat Dec 20 22:53:55 2025 ] Training epoch: 35
[ Sat Dec 20 22:57:41 2025 ] 	Mean training loss: 0.2312.  Mean training acc: 92.12%.
[ Sat Dec 20 22:57:41 2025 ] 	Time consumption: [Data]00%, [Network]100%
[ Sat Dec 20 22:57:41 2025 ] Eval epoch: 35
[ Sat Dec 20 22:58:09 2025 ] 	Mean test loss of 258 batches: 0.839664509823156.
[ Sat Dec 20 22:58:09 2025 ] 	Top1: 76.90%
[ Sat Dec 20 22:58:09 2025 ] 	Top5: 96.55%
[ Sat Dec 20 22:58:09 2025 ] Training epoch: 36
[ Sat Dec 20 23:01:54 2025 ] 	Mean training loss: 0.1277.  Mean training acc: 95.88%.
[ Sat Dec 20 23:01:54 2025 ] 	Time consumption: [Data]00%, [Network]100%
[ Sat Dec 20 23:01:54 2025 ] Eval epoch: 36
[ Sat Dec 20 23:02:22 2025 ] 	Mean test loss of 258 batches: 0.4740249460866285.
[ Sat Dec 20 23:02:22 2025 ] 	Top1: 86.28%
[ Sat Dec 20 23:02:22 2025 ] 	Top5: 98.45%
[ Sat Dec 20 23:02:22 2025 ] Training epoch: 37
[ Sat Dec 20 23:06:08 2025 ] 	Mean training loss: 0.0877.  Mean training acc: 97.36%.
[ Sat Dec 20 23:06:08 2025 ] 	Time consumption: [Data]00%, [Network]100%
[ Sat Dec 20 23:06:08 2025 ] Eval epoch: 37
[ Sat Dec 20 23:06:36 2025 ] 	Mean test loss of 258 batches: 0.4690984363068444.
[ Sat Dec 20 23:06:36 2025 ] 	Top1: 86.47%
[ Sat Dec 20 23:06:36 2025 ] 	Top5: 98.60%
[ Sat Dec 20 23:06:36 2025 ] Training epoch: 38
[ Sat Dec 20 23:10:22 2025 ] 	Mean training loss: 0.0779.  Mean training acc: 97.77%.
[ Sat Dec 20 23:10:22 2025 ] 	Time consumption: [Data]00%, [Network]100%
[ Sat Dec 20 23:10:22 2025 ] Eval epoch: 38
[ Sat Dec 20 23:10:50 2025 ] 	Mean test loss of 258 batches: 0.47382982892467995.
[ Sat Dec 20 23:10:50 2025 ] 	Top1: 86.42%
[ Sat Dec 20 23:10:50 2025 ] 	Top5: 98.49%
[ Sat Dec 20 23:10:50 2025 ] Training epoch: 39
[ Sat Dec 20 23:14:35 2025 ] 	Mean training loss: 0.0694.  Mean training acc: 97.96%.
[ Sat Dec 20 23:14:35 2025 ] 	Time consumption: [Data]00%, [Network]100%
[ Sat Dec 20 23:14:36 2025 ] Eval epoch: 39
[ Sat Dec 20 23:15:04 2025 ] 	Mean test loss of 258 batches: 0.47407661730697914.
[ Sat Dec 20 23:15:04 2025 ] 	Top1: 86.44%
[ Sat Dec 20 23:15:04 2025 ] 	Top5: 98.51%
[ Sat Dec 20 23:15:04 2025 ] Training epoch: 40
[ Sat Dec 20 23:18:49 2025 ] 	Mean training loss: 0.0634.  Mean training acc: 98.20%.
[ Sat Dec 20 23:18:49 2025 ] 	Time consumption: [Data]00%, [Network]100%
[ Sat Dec 20 23:18:50 2025 ] Eval epoch: 40
[ Sat Dec 20 23:19:17 2025 ] 	Mean test loss of 258 batches: 0.47821812201724495.
[ Sat Dec 20 23:19:18 2025 ] 	Top1: 86.37%
[ Sat Dec 20 23:19:18 2025 ] 	Top5: 98.47%
[ Sat Dec 20 23:19:18 2025 ] Training epoch: 41
[ Sat Dec 20 23:23:03 2025 ] 	Mean training loss: 0.0602.  Mean training acc: 98.22%.
[ Sat Dec 20 23:23:03 2025 ] 	Time consumption: [Data]00%, [Network]100%
[ Sat Dec 20 23:23:03 2025 ] Eval epoch: 41
[ Sat Dec 20 23:23:31 2025 ] 	Mean test loss of 258 batches: 0.4817158560189166.
[ Sat Dec 20 23:23:31 2025 ] 	Top1: 86.44%
[ Sat Dec 20 23:23:31 2025 ] 	Top5: 98.44%
[ Sat Dec 20 23:23:31 2025 ] Training epoch: 42
[ Sat Dec 20 23:27:16 2025 ] 	Mean training loss: 0.0542.  Mean training acc: 98.47%.
[ Sat Dec 20 23:27:16 2025 ] 	Time consumption: [Data]00%, [Network]100%
[ Sat Dec 20 23:27:16 2025 ] Eval epoch: 42
[ Sat Dec 20 23:27:44 2025 ] 	Mean test loss of 258 batches: 0.4859829977039219.
[ Sat Dec 20 23:27:44 2025 ] 	Top1: 86.37%
[ Sat Dec 20 23:27:44 2025 ] 	Top5: 98.40%
[ Sat Dec 20 23:27:44 2025 ] Training epoch: 43
[ Sat Dec 20 23:31:30 2025 ] 	Mean training loss: 0.0525.  Mean training acc: 98.49%.
[ Sat Dec 20 23:31:30 2025 ] 	Time consumption: [Data]00%, [Network]100%
[ Sat Dec 20 23:31:30 2025 ] Eval epoch: 43
[ Sat Dec 20 23:31:58 2025 ] 	Mean test loss of 258 batches: 0.4972188807735147.
[ Sat Dec 20 23:31:58 2025 ] 	Top1: 86.37%
[ Sat Dec 20 23:31:58 2025 ] 	Top5: 98.46%
[ Sat Dec 20 23:31:58 2025 ] Training epoch: 44
[ Sat Dec 20 23:35:44 2025 ] 	Mean training loss: 0.0484.  Mean training acc: 98.69%.
[ Sat Dec 20 23:35:44 2025 ] 	Time consumption: [Data]00%, [Network]100%
[ Sat Dec 20 23:35:44 2025 ] Eval epoch: 44
[ Sat Dec 20 23:36:12 2025 ] 	Mean test loss of 258 batches: 0.48964303509556045.
[ Sat Dec 20 23:36:12 2025 ] 	Top1: 86.38%
[ Sat Dec 20 23:36:13 2025 ] 	Top5: 98.44%
[ Sat Dec 20 23:36:13 2025 ] Training epoch: 45
[ Sat Dec 20 23:39:58 2025 ] 	Mean training loss: 0.0462.  Mean training acc: 98.76%.
[ Sat Dec 20 23:39:58 2025 ] 	Time consumption: [Data]00%, [Network]100%
[ Sat Dec 20 23:39:58 2025 ] Eval epoch: 45
[ Sat Dec 20 23:40:26 2025 ] 	Mean test loss of 258 batches: 0.49616480916160943.
[ Sat Dec 20 23:40:26 2025 ] 	Top1: 86.50%
[ Sat Dec 20 23:40:26 2025 ] 	Top5: 98.39%
[ Sat Dec 20 23:40:26 2025 ] Training epoch: 46
[ Sat Dec 20 23:44:12 2025 ] 	Mean training loss: 0.0462.  Mean training acc: 98.70%.
[ Sat Dec 20 23:44:12 2025 ] 	Time consumption: [Data]00%, [Network]100%
[ Sat Dec 20 23:44:12 2025 ] Eval epoch: 46
[ Sat Dec 20 23:44:40 2025 ] 	Mean test loss of 258 batches: 0.504727001597946.
[ Sat Dec 20 23:44:40 2025 ] 	Top1: 85.98%
[ Sat Dec 20 23:44:40 2025 ] 	Top5: 98.37%
[ Sat Dec 20 23:44:40 2025 ] Training epoch: 47
[ Sat Dec 20 23:48:26 2025 ] 	Mean training loss: 0.0394.  Mean training acc: 98.96%.
[ Sat Dec 20 23:48:26 2025 ] 	Time consumption: [Data]00%, [Network]100%
[ Sat Dec 20 23:48:26 2025 ] Eval epoch: 47
[ Sat Dec 20 23:48:54 2025 ] 	Mean test loss of 258 batches: 0.5069713485391103.
[ Sat Dec 20 23:48:54 2025 ] 	Top1: 86.19%
[ Sat Dec 20 23:48:54 2025 ] 	Top5: 98.27%
[ Sat Dec 20 23:48:54 2025 ] Training epoch: 48
[ Sat Dec 20 23:52:40 2025 ] 	Mean training loss: 0.0392.  Mean training acc: 98.93%.
[ Sat Dec 20 23:52:40 2025 ] 	Time consumption: [Data]00%, [Network]100%
[ Sat Dec 20 23:52:40 2025 ] Eval epoch: 48
[ Sat Dec 20 23:53:08 2025 ] 	Mean test loss of 258 batches: 0.5073449050271234.
[ Sat Dec 20 23:53:08 2025 ] 	Top1: 86.46%
[ Sat Dec 20 23:53:08 2025 ] 	Top5: 98.31%
[ Sat Dec 20 23:53:08 2025 ] Training epoch: 49
[ Sat Dec 20 23:56:53 2025 ] 	Mean training loss: 0.0395.  Mean training acc: 98.90%.
[ Sat Dec 20 23:56:53 2025 ] 	Time consumption: [Data]00%, [Network]100%
[ Sat Dec 20 23:56:53 2025 ] Eval epoch: 49
[ Sat Dec 20 23:57:22 2025 ] 	Mean test loss of 258 batches: 0.5211439238095931.
[ Sat Dec 20 23:57:22 2025 ] 	Top1: 85.86%
[ Sat Dec 20 23:57:22 2025 ] 	Top5: 98.29%
[ Sat Dec 20 23:57:22 2025 ] Training epoch: 50
[ Sun Dec 21 00:01:07 2025 ] 	Mean training loss: 0.0363.  Mean training acc: 99.00%.
[ Sun Dec 21 00:01:07 2025 ] 	Time consumption: [Data]00%, [Network]100%
[ Sun Dec 21 00:01:07 2025 ] Eval epoch: 50
[ Sun Dec 21 00:01:35 2025 ] 	Mean test loss of 258 batches: 0.5237474289917669.
[ Sun Dec 21 00:01:36 2025 ] 	Top1: 85.83%
[ Sun Dec 21 00:01:36 2025 ] 	Top5: 98.27%
[ Sun Dec 21 00:01:36 2025 ] Training epoch: 51
[ Sun Dec 21 00:05:21 2025 ] 	Mean training loss: 0.0340.  Mean training acc: 99.09%.
[ Sun Dec 21 00:05:21 2025 ] 	Time consumption: [Data]00%, [Network]99%
[ Sun Dec 21 00:05:21 2025 ] Eval epoch: 51
[ Sun Dec 21 00:05:49 2025 ] 	Mean test loss of 258 batches: 0.5230521001788073.
[ Sun Dec 21 00:05:49 2025 ] 	Top1: 86.04%
[ Sun Dec 21 00:05:49 2025 ] 	Top5: 98.36%
[ Sun Dec 21 00:05:49 2025 ] Training epoch: 52
[ Sun Dec 21 00:09:34 2025 ] 	Mean training loss: 0.0342.  Mean training acc: 99.14%.
[ Sun Dec 21 00:09:34 2025 ] 	Time consumption: [Data]00%, [Network]100%
[ Sun Dec 21 00:09:34 2025 ] Eval epoch: 52
[ Sun Dec 21 00:10:02 2025 ] 	Mean test loss of 258 batches: 0.5222611752475879.
[ Sun Dec 21 00:10:02 2025 ] 	Top1: 86.25%
[ Sun Dec 21 00:10:02 2025 ] 	Top5: 98.25%
[ Sun Dec 21 00:10:02 2025 ] Training epoch: 53
[ Sun Dec 21 00:13:48 2025 ] 	Mean training loss: 0.0328.  Mean training acc: 99.15%.
[ Sun Dec 21 00:13:48 2025 ] 	Time consumption: [Data]00%, [Network]100%
[ Sun Dec 21 00:13:48 2025 ] Eval epoch: 53
[ Sun Dec 21 00:14:16 2025 ] 	Mean test loss of 258 batches: 0.5161713278859623.
[ Sun Dec 21 00:14:16 2025 ] 	Top1: 86.15%
[ Sun Dec 21 00:14:16 2025 ] 	Top5: 98.24%
[ Sun Dec 21 00:14:16 2025 ] Training epoch: 54
[ Sun Dec 21 00:18:01 2025 ] 	Mean training loss: 0.0324.  Mean training acc: 99.18%.
[ Sun Dec 21 00:18:01 2025 ] 	Time consumption: [Data]00%, [Network]100%
[ Sun Dec 21 00:18:01 2025 ] Eval epoch: 54
[ Sun Dec 21 00:18:30 2025 ] 	Mean test loss of 258 batches: 0.5319196562203325.
[ Sun Dec 21 00:18:30 2025 ] 	Top1: 85.85%
[ Sun Dec 21 00:18:30 2025 ] 	Top5: 98.23%
[ Sun Dec 21 00:18:30 2025 ] Training epoch: 55
[ Sun Dec 21 00:22:16 2025 ] 	Mean training loss: 0.0283.  Mean training acc: 99.32%.
[ Sun Dec 21 00:22:16 2025 ] 	Time consumption: [Data]00%, [Network]100%
[ Sun Dec 21 00:22:16 2025 ] Eval epoch: 55
[ Sun Dec 21 00:22:44 2025 ] 	Mean test loss of 258 batches: 0.5342182221627513.
[ Sun Dec 21 00:22:44 2025 ] 	Top1: 86.18%
[ Sun Dec 21 00:22:44 2025 ] 	Top5: 98.10%
[ Sun Dec 21 00:22:44 2025 ] Training epoch: 56
[ Sun Dec 21 00:26:30 2025 ] 	Mean training loss: 0.0240.  Mean training acc: 99.42%.
[ Sun Dec 21 00:26:30 2025 ] 	Time consumption: [Data]00%, [Network]100%
[ Sun Dec 21 00:26:30 2025 ] Eval epoch: 56
[ Sun Dec 21 00:26:58 2025 ] 	Mean test loss of 258 batches: 0.5242365852229355.
[ Sun Dec 21 00:26:58 2025 ] 	Top1: 86.17%
[ Sun Dec 21 00:26:58 2025 ] 	Top5: 98.25%
[ Sun Dec 21 00:26:58 2025 ] Training epoch: 57
[ Sun Dec 21 00:30:43 2025 ] 	Mean training loss: 0.0227.  Mean training acc: 99.48%.
[ Sun Dec 21 00:30:43 2025 ] 	Time consumption: [Data]00%, [Network]100%
[ Sun Dec 21 00:30:44 2025 ] Eval epoch: 57
[ Sun Dec 21 00:31:12 2025 ] 	Mean test loss of 258 batches: 0.5263107547810836.
[ Sun Dec 21 00:31:12 2025 ] 	Top1: 86.01%
[ Sun Dec 21 00:31:12 2025 ] 	Top5: 98.28%
[ Sun Dec 21 00:31:12 2025 ] Training epoch: 58
[ Sun Dec 21 00:34:57 2025 ] 	Mean training loss: 0.0213.  Mean training acc: 99.58%.
[ Sun Dec 21 00:34:57 2025 ] 	Time consumption: [Data]00%, [Network]100%
[ Sun Dec 21 00:34:57 2025 ] Eval epoch: 58
[ Sun Dec 21 00:35:25 2025 ] 	Mean test loss of 258 batches: 0.523325811696145.
[ Sun Dec 21 00:35:25 2025 ] 	Top1: 86.16%
[ Sun Dec 21 00:35:25 2025 ] 	Top5: 98.24%
[ Sun Dec 21 00:35:25 2025 ] Training epoch: 59
[ Sun Dec 21 00:39:10 2025 ] 	Mean training loss: 0.0202.  Mean training acc: 99.57%.
[ Sun Dec 21 00:39:10 2025 ] 	Time consumption: [Data]00%, [Network]100%
[ Sun Dec 21 00:39:10 2025 ] Eval epoch: 59
[ Sun Dec 21 00:39:38 2025 ] 	Mean test loss of 258 batches: 0.5276079935620922.
[ Sun Dec 21 00:39:38 2025 ] 	Top1: 86.11%
[ Sun Dec 21 00:39:38 2025 ] 	Top5: 98.27%
[ Sun Dec 21 00:39:38 2025 ] Training epoch: 60
[ Sun Dec 21 00:43:24 2025 ] 	Mean training loss: 0.0198.  Mean training acc: 99.62%.
[ Sun Dec 21 00:43:24 2025 ] 	Time consumption: [Data]00%, [Network]100%
[ Sun Dec 21 00:43:24 2025 ] Eval epoch: 60
[ Sun Dec 21 00:43:52 2025 ] 	Mean test loss of 258 batches: 0.5220684224898501.
[ Sun Dec 21 00:43:52 2025 ] 	Top1: 86.33%
[ Sun Dec 21 00:43:52 2025 ] 	Top5: 98.33%
[ Sun Dec 21 00:43:52 2025 ] Training epoch: 61
[ Sun Dec 21 00:47:37 2025 ] 	Mean training loss: 0.0201.  Mean training acc: 99.56%.
[ Sun Dec 21 00:47:37 2025 ] 	Time consumption: [Data]00%, [Network]100%
[ Sun Dec 21 00:47:38 2025 ] Eval epoch: 61
[ Sun Dec 21 00:48:05 2025 ] 	Mean test loss of 258 batches: 0.52462501517793.
[ Sun Dec 21 00:48:06 2025 ] 	Top1: 86.18%
[ Sun Dec 21 00:48:06 2025 ] 	Top5: 98.23%
[ Sun Dec 21 00:48:06 2025 ] Training epoch: 62
[ Sun Dec 21 00:51:51 2025 ] 	Mean training loss: 0.0205.  Mean training acc: 99.53%.
[ Sun Dec 21 00:51:51 2025 ] 	Time consumption: [Data]00%, [Network]100%
[ Sun Dec 21 00:51:51 2025 ] Eval epoch: 62
[ Sun Dec 21 00:52:19 2025 ] 	Mean test loss of 258 batches: 0.5279052396442077.
[ Sun Dec 21 00:52:19 2025 ] 	Top1: 86.16%
[ Sun Dec 21 00:52:19 2025 ] 	Top5: 98.21%
[ Sun Dec 21 00:52:19 2025 ] Training epoch: 63
[ Sun Dec 21 00:56:05 2025 ] 	Mean training loss: 0.0194.  Mean training acc: 99.62%.
[ Sun Dec 21 00:56:05 2025 ] 	Time consumption: [Data]00%, [Network]100%
[ Sun Dec 21 00:56:06 2025 ] Eval epoch: 63
[ Sun Dec 21 00:56:34 2025 ] 	Mean test loss of 258 batches: 0.5288152131288089.
[ Sun Dec 21 00:56:34 2025 ] 	Top1: 86.13%
[ Sun Dec 21 00:56:34 2025 ] 	Top5: 98.27%
[ Sun Dec 21 00:56:34 2025 ] Training epoch: 64
[ Sun Dec 21 01:00:20 2025 ] 	Mean training loss: 0.0183.  Mean training acc: 99.64%.
[ Sun Dec 21 01:00:20 2025 ] 	Time consumption: [Data]00%, [Network]100%
[ Sun Dec 21 01:00:20 2025 ] Eval epoch: 64
[ Sun Dec 21 01:00:48 2025 ] 	Mean test loss of 258 batches: 0.5255800705951775.
[ Sun Dec 21 01:00:48 2025 ] 	Top1: 86.15%
[ Sun Dec 21 01:00:48 2025 ] 	Top5: 98.27%
[ Sun Dec 21 01:00:48 2025 ] Training epoch: 65
[ Sun Dec 21 01:04:34 2025 ] 	Mean training loss: 0.0195.  Mean training acc: 99.60%.
[ Sun Dec 21 01:04:34 2025 ] 	Time consumption: [Data]00%, [Network]100%
[ Sun Dec 21 01:04:34 2025 ] Eval epoch: 65
[ Sun Dec 21 01:05:02 2025 ] 	Mean test loss of 258 batches: 0.5277919485414213.
[ Sun Dec 21 01:05:02 2025 ] 	Top1: 86.01%
[ Sun Dec 21 01:05:02 2025 ] 	Top5: 98.24%
[ Sun Dec 21 01:05:31 2025 ] Best accuracy: 0.8649845332686359
[ Sun Dec 21 01:05:31 2025 ] Epoch number (best accuracy epoch): 45
[ Sun Dec 21 01:05:31 2025 ] Model name: /content/drive/MyDrive/Colab Notebooks/thesis_outline_colabs/CTR-GCN/runs/test_run_ntu60_2d_2
[ Sun Dec 21 01:05:31 2025 ] Model total number of params: 1434586
[ Sun Dec 21 01:05:31 2025 ] Weight decay: 0.0004
[ Sun Dec 21 01:05:31 2025 ] Base LR: 0.1
[ Sun Dec 21 01:05:31 2025 ] Batch Size: 256
[ Sun Dec 21 01:05:31 2025 ] Test Batch Size: 64
[ Sun Dec 21 01:05:31 2025 ] seed: 1
